{
  "schemaVersion": "4.1.0",
  "skillName": "api-sql-fixture-preparer",
  "manifestType": "table-checks",
  "updatedAt": "2026-05-23T19:41:55+08:00",
  "executionId": "Common",
  "apiId": "COMMON.commonfunc.deldevicebinding",
  "dbTarget": "connection-name:Report",
  "authorityRoot": "../../.agent/reference/global",
  "tables": [
    {
      "tableRef": "DAWHO.dbo.DeviceBinding",
      "resolvedTableName": "DAWHO.dbo.DeviceBinding",
      "exists": true,
      "rowCount": 0,
      "action": "seed",
      "blockReason": null,
      "schemaSql": "../../.agent/context/Common/apis/COMMON.commonfunc.deldevicebinding/generated-schema-dawho_dbo_devicebinding.sql",
      "seedSql": "../../.agent/context/Common/apis/COMMON.commonfunc.deldevicebinding/generated-seed-dawho_dbo_devicebinding.sql"
    },
    {
      "tableRef": "DAWHO.dbo.DeviceBindingLog",
      "resolvedTableName": null,
      "exists": false,
      "rowCount": null,
      "action": "create",
      "blockReason": "missing_schema_authority",
      "schemaSql": null,
      "seedSql": null
    },
    {
      "tableRef": "dbo.MB_PUSHTYPESETTING",
      "resolvedTableName": null,
      "exists": false,
      "rowCount": null,
      "action": "create",
      "blockReason": null,
      "schemaSql": "../../.agent/context/Common/apis/COMMON.commonfunc.deldevicebinding/generated-schema-dbo_mb_pushtypesetting.sql",
      "seedSql": "../../.agent/context/Common/apis/COMMON.commonfunc.deldevicebinding/generated-seed-dbo_mb_pushtypesetting.sql"
    },
    {
      "tableRef": "DAWHO.DBO.DEVICEBINDING",
      "resolvedTableName": "DAWHO.dbo.DeviceBinding",
      "exists": true,
      "rowCount": 0,
      "action": "seed",
      "blockReason": null,
      "schemaSql": "../../.agent/context/Common/apis/COMMON.commonfunc.deldevicebinding/generated-schema-dawho_dbo_devicebinding.sql",
      "seedSql": "../../.agent/context/Common/apis/COMMON.commonfunc.deldevicebinding/generated-seed-dawho_dbo_devicebinding.sql"
    },
    {
      "tableRef": "DAWHO.DBO.DEVICEBINDINGLOG",
      "resolvedTableName": null,
      "exists": false,
      "rowCount": null,
      "action": "create",
      "blockReason": "missing_schema_authority",
      "schemaSql": null,
      "seedSql": null
    },
    {
      "tableRef": "DBO.MB_PUSHTYPESETTING",
      "resolvedTableName": null,
      "exists": false,
      "rowCount": null,
      "action": "create",
      "blockReason": null,
      "schemaSql": "../../.agent/context/Common/apis/COMMON.commonfunc.deldevicebinding/generated-schema-dbo_mb_pushtypesetting.sql",
      "seedSql": "../../.agent/context/Common/apis/COMMON.commonfunc.deldevicebinding/generated-seed-dbo_mb_pushtypesetting.sql"
    }
  ]
}
