{
  "schemaVersion": "4.1.0",
  "skillName": "api-sql-fixture-preparer",
  "manifestType": "table-checks",
  "updatedAt": "2026-05-23T19:42:38+08:00",
  "executionId": "Common",
  "apiId": "COMMON.commonfunc.getoperationhour",
  "dbTarget": "connection-name:Report",
  "authorityRoot": "../../.agent/reference/global",
  "tables": [
    {
      "tableRef": "TBDAY",
      "resolvedTableName": "EAINET.dbo.TBDAY",
      "exists": true,
      "rowCount": 1,
      "action": "reuse",
      "blockReason": null,
      "schemaSql": null,
      "seedSql": null
    }
  ]
}
