{
  "schemaVersion": "4.1.0",
  "skillName": "api-sql-fixture-preparer",
  "manifestType": "table-checks",
  "updatedAt": "2026-05-23T19:42:25+08:00",
  "executionId": "Common",
  "apiId": "COMMON.commonfunc.getdevicebinding",
  "dbTarget": "connection-name:Report",
  "authorityRoot": "../../.agent/reference/global",
  "tables": [
    {
      "tableRef": "Dawho.DeviceBinding",
      "resolvedTableName": "Dawho.dbo.DeviceBinding",
      "exists": true,
      "rowCount": 0,
      "action": "seed",
      "blockReason": null,
      "schemaSql": "../../.agent/context/Common/apis/COMMON.commonfunc.getdevicebinding/generated-schema-dawho_devicebinding.sql",
      "seedSql": "../../.agent/context/Common/apis/COMMON.commonfunc.getdevicebinding/generated-seed-dawho_devicebinding.sql"
    },
    {
      "tableRef": "MMA.User",
      "resolvedTableName": null,
      "exists": false,
      "rowCount": null,
      "action": "create",
      "blockReason": "missing_schema_authority",
      "schemaSql": null,
      "seedSql": null
    }
  ]
}
