{
  "schemaVersion": "4.1.0",
  "skillName": "api-sql-fixture-preparer",
  "manifestType": "table-checks",
  "updatedAt": "2026-05-23T18:03:41+08:00",
  "executionId": "Common",
  "apiId": "COMMON.commonfunc.getrateenquiry",
  "dbTarget": "ConnectionStrings.Report",
  "authorityRoot": null,
  "tables": []
}
