{
  "schemaVersion": "4.1.0",
  "skillName": "api-sql-fixture-preparer",
  "manifestType": "table-checks",
  "updatedAt": "2026-05-23T19:41:27+08:00",
  "executionId": "Common",
  "apiId": "COMMON.depositcommonutil.getdawhofixsetting",
  "dbTarget": "connection-name:Report",
  "authorityRoot": "../../.agent/reference/global",
  "tables": []
}
