{
  "schemaVersion": "4.1.0",
  "skillName": "api-sql-fixture-preparer",
  "manifestType": "table-checks",
  "updatedAt": "2026-05-23T19:42:13+08:00",
  "executionId": "Common",
  "apiId": "COMMON.commonfunc.getcencurr",
  "dbTarget": "connection-name:Report",
  "authorityRoot": "../../.agent/reference/global",
  "tables": [
    {
      "tableRef": "J_CURR",
      "resolvedTableName": "MMA.dbo.J_CURR",
      "exists": true,
      "rowCount": 20,
      "action": "reuse",
      "blockReason": null,
      "schemaSql": null,
      "seedSql": null
    }
  ]
}
